[
  {
    "id": "astralis_grand_market",
    "name": "アストラリス大市場",
    "category": "market",
    "type": "commercial",
    "continent_id": "elysion",
    "region_id": "royal_capital_region",
    "nearest_node_id": "astralis",
    "position": {
      "x": 4880,
      "y": 5000,
      "z": 0
    },
    "importance": 5,
    "status": "active",
    "description": "王都アストラリス最大の市場。中央街道と王都交通網の結節点として、各大陸からの交易品が集まる。",
    "lore_basis": [
      "王都アストラリスが政治・交通の中心であること",
      "中央街道と王都交通網が接続していること",
      "エリュシオンが秩序ある交易圏であること"
    ],
    "historical_reason": "王都拡張期に街道交易と王宮御用商人の集積地として形成された。",
    "economic_role": "広域交易、市民市場、王宮納品、冒険者向け物資供給。",
    "cultural_role": "王都市民の日常生活と祭礼市の中心。",
    "transport_role": "中央街道と王都交通網から徒歩圏内に位置する。",
    "risk_context": "王都内のため治安は比較的安定しているが、祭礼期は混雑対策が必要。",
    "tags": [
      "trade",
      "capital",
      "market",
      "elysion",
      "sample"
    ]
  },
  {
    "id": "astralis_royal_palace",
    "name": "アストラリス王宮",
    "category": "government",
    "type": "royal_palace",
    "continent_id": "elysion",
    "region_id": "royal_capital_region",
    "nearest_node_id": "astralis",
    "position": {
      "x": 5100,
      "y": 4380,
      "z": 0
    },
    "importance": 5,
    "status": "active",
    "description": "エリュシオン王権の中枢であり、王都アストラリスの政治・儀礼・外交の中心となる宮殿。",
    "lore_basis": [
      "アストラリスがエリュシオンの王都であること",
      "エリュシオンが秩序ある政治・交易圏として設定されていること",
      "王都が中央大陸の政治的中心であること"
    ],
    "historical_reason": "王都形成期に、街道交通と周辺諸都市を統合する統治拠点として築かれた。",
    "economic_role": "王宮御用商人、行政機関、儀礼需要を通じて王都経済を支える。",
    "cultural_role": "国家儀礼、祝祭、騎士叙任、外交儀礼の中心。",
    "transport_role": "王都中心部に位置し、中央街道・行政区・市場区へ短時間で移動できる。",
    "risk_context": "警備は厳重であり、立入には身分確認や許可が必要。",
    "tags": [
      "astralis",
      "elysion",
      "capital",
      "government",
      "royal"
    ]
  },
  {
    "id": "astralis_admin_hall",
    "name": "王都行政庁",
    "category": "government",
    "type": "city_hall",
    "continent_id": "elysion",
    "region_id": "royal_capital_region",
    "nearest_node_id": "astralis",
    "position": {
      "x": 4930,
      "y": 4510,
      "z": 0
    },
    "importance": 4,
    "status": "draft",
    "description": "王都アストラリスの日常行政を司る中枢庁舎。市民登録、税務、許可発布などを取り扱う。",
    "lore_basis": [
      "アストラリスがエリュシオンの王都であること",
      "エリュシオンが秩序ある行政システムを有すること",
      "王都に行政機関が集中していること"
    ],
    "historical_reason": "王都拡張に伴い、分散していた行政機能を集約するために設立された。",
    "economic_role": "都市運営、商工業登録、税収管理、公共事業発注。",
    "cultural_role": "市民の権利義務手続きの中心として、日常生活に深く関わる。",
    "transport_role": "王宮から徒歩圏内にあり、主要道路からもアクセス良好。",
    "risk_context": "公的文書を取り扱うため、セキュリティは中程度。立入には身分証明が必要な区域あり。",
    "tags": [
      "astralis",
      "elysion",
      "government",
      "administration",
      "capital"
    ],
    "aliases": [
      "astralis_administration_hall"
    ]
  },
  {
    "id": "astralis_carriage_plaza",
    "name": "アストラリス中央駅馬車広場",
    "category": "transport",
    "type": "carriage_terminal",
    "continent_id": "elysion",
    "region_id": "royal_capital_region",
    "nearest_node_id": "astralis",
    "position": {
      "x": 4700,
      "y": 4940,
      "z": 0
    },
    "importance": 4,
    "status": "active",
    "description": "王都の駅馬車ターミナル。全主要街道へ向かう便が発着し、中央大陸の交通結節点として機能する。",
    "lore_basis": [
      "アストラリスが中央街道の起点として設定されていること",
      "王都交通網が整備されていること",
      "エリュシオン内の街道ネットワークが発達していること"
    ],
    "historical_reason": "王都建設当初から存在する交通施設で、街道整備とともに拡張されてきた。",
    "economic_role": "旅客輸送、貨物輸送、旅人向けサービス、地域間物流の結節点。",
    "cultural_role": "旅人や商人が集う情報交換の場として、王都の多様性を象徴する。",
    "transport_role": "中央街道、王都内各街区、港湾部への連絡が集中する。",
    "risk_context": "混雑時には置き引きや詐欺に注意。騎士団による巡回が定期的に行われる。",
    "tags": [
      "astralis",
      "elysion",
      "transport",
      "carriage",
      "terminal"
    ],
    "aliases": [
      "astralis_central_coach_square"
    ]
  },
  {
    "id": "astralis_west_gate",
    "name": "王都街道門",
    "category": "transport",
    "type": "city_gate",
    "continent_id": "elysion",
    "region_id": "royal_capital_region",
    "nearest_node_id": "astralis",
    "position": {
      "x": 4520,
      "y": 4980,
      "z": 0
    },
    "importance": 3,
    "status": "draft",
    "description": "王都アストラリスの西側正面門。中央街道から直接王都内へ至る主要出入り口。",
    "lore_basis": [
      "アストラリスが中央街道の起点として設定されていること",
      "王都が防御と管理のための門を有すること",
      "エリュシオンの秩序維持のため検問が存在すること"
    ],
    "historical_reason": "王都建設当初に設けられた門で、西方からの街道交易路を統制する目的で築かれた。",
    "economic_role": "西部からの商品・旅客の流入管理、関税・検問、都市防衛の第一線。",
    "cultural_role": "儀礼的行進や行列の出入り口として、国家的行事にも使用される。",
    "transport_role": "中央街道の終点に位置し、王都内道路網の起点となる。",
    "risk_context": "検問所のため治安は比較的安定。ただし、密輸や密入国への警戒が常時行われている。",
    "tags": [
      "astralis",
      "elysion",
      "transport",
      "gate",
      "checkpoint"
    ],
    "aliases": [
      "astralis_road_gate"
    ]
  },
  {
    "id": "astralis_alchemist_row",
    "name": "錬金術師通り",
    "category": "shop",
    "type": "alchemy",
    "continent_id": "elysion",
    "region_id": "royal_capital_region",
    "nearest_node_id": "astralis",
    "position": {
      "x": 5310,
      "y": 4840,
      "z": 0
    },
    "importance": 3,
    "status": "draft",
    "description": "王都でも有数の錬金術師と魔法薬店が軒を連ねる専門店街。魔法学術区に隣接。",
    "lore_basis": [
      "アストラリスに王立魔法学院が存在すること",
      "エリュシオンで魔法と学術が保護されていること",
      "王都に専門職人街が形成されていること"
    ],
    "historical_reason": "王立魔法学院の設立に伴い、その学生・研究者向けの専門店が集積して形成された。",
    "economic_role": "魔法薬、魔導具、研究材料の販売。学者・学生・冒険者向けの高単価商取引。",
    "cultural_role": "魔法技術の実用化と普及を担う場として、学術区と一体となった文化を形成。",
    "transport_role": "王立魔法学院と大市場の中間に位置し、徒歩でアクセス可能。",
    "risk_context": "危険な薬品や魔導具も扱うため、未成年者立入制限と販売規制あり。騎士団の抜き打ち検査が行われる。",
    "tags": [
      "astralis",
      "elysion",
      "alchemy",
      "shop",
      "magic"
    ]
  },
  {
    "id": "astralis_laurel_inn",
    "name": "月桂樹の宿",
    "category": "inn",
    "type": "coaching_inn",
    "continent_id": "elysion",
    "region_id": "royal_capital_region",
    "nearest_node_id": "astralis",
    "position": {
      "x": 4640,
      "y": 5170,
      "z": 0
    },
    "importance": 2,
    "status": "draft",
    "description": "王都で古くから営業する中級宿泊施設。駅馬車広場から徒歩圏内で、旅人に人気。",
    "lore_basis": [
      "アストラリスに交通ターミナルが存在すること",
      "王都に宿泊施設が必要であること",
      "エリュシオンの街道網が発達していること"
    ],
    "historical_reason": "王都拡張期に駅馬車利用者のために設けられた宿泊所が原型。",
    "economic_role": "宿泊、食事、馬車の手配、荷物預かり。",
    "cultural_role": "旅人同士の情報交換の場として、王都の玄関口的役割を果たす。",
    "transport_role": "中央駅馬車広場から徒歩5分程度。",
    "risk_context": "王都内のため治安は良好。ただし、深夜の外出には注意。",
    "tags": [
      "astralis",
      "elysion",
      "inn",
      "traveler",
      "coaching"
    ]
  },
  {
    "id": "astralis_silver_owl_tavern",
    "name": "銀梟亭",
    "category": "food",
    "type": "tavern",
    "continent_id": "elysion",
    "region_id": "royal_capital_region",
    "nearest_node_id": "astralis",
    "position": {
      "x": 4940,
      "y": 5210,
      "z": 0
    },
    "importance": 2,
    "status": "draft",
    "description": "王都の下町エリアにある古風な酒場。冒険者や職人に人気の隠れ家的店舗。",
    "lore_basis": [
      "王都に庶民の飲食施設が存在すること",
      "冒険者文化がエリュシオンに根付いていること",
      "職人階級が都市経済を支えていること"
    ],
    "historical_reason": "王都の職人街のそばに自然発生的にできた酒場が起源。",
    "economic_role": "飲食提供、地域情報の交換、一時労働の仲介。",
    "cultural_role": "庶民の社交場として、職人や冒険者の情報ネットワークの一翼を担う。",
    "transport_role": "大市場と職人街の中間に位置し、徒歩アクセス良好。",
    "risk_context": "夜間は軽犯罪が多発するため、一人での外出は推奨されない。騎士団の夜間巡邏あり。",
    "tags": [
      "astralis",
      "elysion",
      "tavern",
      "traveler",
      "guild"
    ]
  },
  {
    "id": "astralis_magic_academy",
    "name": "王立魔法学院",
    "category": "academy",
    "type": "magic",
    "continent_id": "elysion",
    "region_id": "royal_capital_region",
    "nearest_node_id": "astralis",
    "position": {
      "x": 5430,
      "y": 4630,
      "z": 0
    },
    "importance": 5,
    "status": "active",
    "description": "エリュシオン最高峰の魔法教育機関。王都の学術・文化・魔術の中枢を成す。",
    "lore_basis": [
      "エリュシオンが秩序ある魔術制度を有すること",
      "アストラリスが王都として学術施設を保護していること",
      "王都に高等教育機関が集中していること"
    ],
    "historical_reason": "王国成立と同時に設立され、魔術師の育成と国家規模の魔法研究を目的とする。",
    "economic_role": "魔法士の育成、国家プロジェクトへの協力、魔導具の研究開発、技術指導。",
    "cultural_role": "魔法文化の保護と発展、学術誌発行、公開講座、王都の知的威信の象徴。",
    "transport_role": "学院専用馬車が王都各所から運行。王宮にも近接。",
    "risk_context": "危険な魔法実験区画は立入制限あり。学院警備隊が常駐。",
    "tags": [
      "astralis",
      "elysion",
      "magic",
      "academy",
      "education"
    ],
    "aliases": [
      "astralis_royal_academy"
    ]
  },
  {
    "id": "astralis_central_archive",
    "name": "中央図書院",
    "category": "culture",
    "type": "library",
    "continent_id": "elysion",
    "region_id": "royal_capital_region",
    "nearest_node_id": "astralis",
    "position": {
      "x": 5270,
      "y": 4680,
      "z": 0
    },
    "importance": 4,
    "status": "draft",
    "description": "王都アストラリスの公文書館兼公立図書館。歴史文書、地図、法律集を収蔵する学術施設。",
    "lore_basis": [
      "王都が行政・歴史の中心であること",
      "エリュシオンで文書管理と学術保存の制度があること",
      "アストラリスに文化施設が集積していること"
    ],
    "historical_reason": "王都の記録院として創設され、後に一般公開を開始した。",
    "economic_role": "学術情報提供、歴史研究支援、公的文書閲覧。",
    "cultural_role": "王都の歴史と文化を継承する場。市民の学習拠点。",
    "transport_role": "王都中心部から徒歩圏内。",
    "risk_context": "貴重書庫は閉架式で、複写・複製には許可が必要。",
    "tags": [
      "astralis",
      "elysion",
      "library",
      "archive",
      "culture"
    ]
  },
  {
    "id": "astralis_star_cup_temple",
    "name": "星杯神殿",
    "category": "temple",
    "type": "cathedral",
    "continent_id": "elysion",
    "region_id": "royal_capital_region",
    "nearest_node_id": "astralis",
    "position": {
      "x": 5000,
      "y": 4620,
      "z": 0
    },
    "importance": 4,
    "status": "active",
    "description": "エリュシオン全土で信仰される星杯教の総本山。王都の精神的中枢を成す大聖堂。",
    "lore_basis": [
      "エリュシオンに星杯教の信仰が広く浸透していること",
      "王都アストラリスが宗教的にも重要拠点であること",
      "星杯神話がエリュシオンの世界観の基盤であること"
    ],
    "historical_reason": "王都創設以前から聖地として知られ、王都建設に伴い公式の総本山として建立された。",
    "economic_role": "宗教収入、巡礼者向けサービス、慈善活動、祭礼経済の中心。",
    "cultural_role": "星杯の祭礼、結婚式、叙任式など、国家レベルの儀礼が行われる。",
    "transport_role": "王都中心部に位置し、主要道路からアクセス良好。巡礼者向け宿泊施設併設。",